<?xml version="1.0" encoding="UTF-8"?>

<!DOCTYPE hechos_historicos SYSTEM "HechosHistoricos.dtd">

<hechos_historicos version="1.1" clave="FDHGFGDS" xml:lang="es">
    <hecho>
        <fecha>
            <formatoFecha>
                <dia>1</dia>
                <mes>1</mes>
                <año>2022</año>
            </formatoFecha>
        </fecha>
        <epoca>
            <EPOCA1></EPOCA1>
        </epoca>
        <PersonajeDestacado paisOrigen="ESPAÑA" cedulasPrimos="cedula1 cedula2">
            Test persona <Nombre></Nombre> y fecha de nacimiento: <FechaNacimiento></FechaNacimiento>
        </PersonajeDestacado>
        <fechaRelevante/>
    </hecho>
    <hecho descripcion="text" autor="oscar">
        <fecha>
            2022-10-09
        </fecha>
        <epoca>
            <EPOCA1></EPOCA1>
        </epoca>
        <epoca>
            <EPOCA2></EPOCA2>
        </epoca>
        <PersonajeDestacado paisOrigen="ALEMANIA" cedula="cedula1"></PersonajeDestacado>
        <PersonajeDestacado paisOrigen="EEUU" cedula="cedula2" cedulaHermano="cedula1"></PersonajeDestacado>
        <fechaRelevante/>
    </hecho>
</hechos_historicos>